{"canvas":{"width":1000,"height":700,"background":"#f6f1e8"},"seed":42,"renderer":"hybrid","build":"p5","layers":[{"id":"background","zIndex":0,"elements":[{"id":"bg-fill","type":"shape","drawStrategy":"primitive","bbox":[0,0,1,1],"geometry":{"kind":"rect"},"style":{"fill":"#e8dcc6","medium":"p5"}}]},{"id":"subject","zIndex":10,"elements":[{"id":"stem","type":"shape","drawStrategy":"spline","bbox":[0.499,0.5142857142857142,0.002,0.32857142857142857],"geometry":{"points":[[0.5,0.5142857142857142],[0.5,0.8428571428571429]],"curvature":0},"style":{"stroke":"#486244","brush":"rotring","strokeWeight":0.9}},{"id":"petal-0","type":"shape","drawStrategy":"primitive","bbox":[0.335,0.30714285714285716,0.17,0.24285714285714285],"geometry":{"kind":"circle"},"style":{"fill":"#d36e70","opacity":110}},{"id":"petal-1","type":"shape","drawStrategy":"primitive","bbox":[0.415,0.19285714285714287,0.17,0.24285714285714285],"geometry":{"kind":"circle"},"style":{"fill":"#d36e70","opacity":110}},{"id":"petal-2","type":"shape","drawStrategy":"primitive","bbox":[0.495,0.30714285714285716,0.17,0.24285714285714285],"geometry":{"kind":"circle"},"style":{"fill":"#d36e70","opacity":110}},{"id":"petal-3","type":"shape","drawStrategy":"primitive","bbox":[0.415,0.42142857142857143,0.17,0.24285714285714285],"geometry":{"kind":"circle"},"style":{"fill":"#d36e70","opacity":110}},{"id":"flower-center","type":"shape","drawStrategy":"primitive","bbox":[0.44,0.34285714285714286,0.12,0.17142857142857143],"geometry":{"kind":"circle"},"style":{"fill":"#f4d26a","opacity":130}}]},{"id":"details","zIndex":20,"elements":[{"id":"title-underline","type":"shape","drawStrategy":"spline","bbox":[0.07,0.22,0.28,0.002857142857142857],"geometry":{"points":[[0.07,0.22142857142857142],[0.35,0.22142857142857142]],"curvature":0},"style":{"stroke":"#7b5d48","brush":"rotring","strokeWeight":0.7}}]},{"id":"lettering","zIndex":30,"elements":[{"id":"title-main","type":"text","drawStrategy":"text","bbox":[0.07,0.08571428571428572,0.4,0.1],"style":{"fill":"#2d241d"},"text":{"content":"夏日散步","language":"zh-Hant","font":{"family":["Noto Sans TC","sans-serif"],"size":40},"align":"left","verticalAlign":"top","lineHeight":1.2,"rotation":0,"renderMode":"p5-text"}},{"id":"subtitle-en","type":"text","drawStrategy":"text","bbox":[0.072,0.16,0.36,0.05714285714285714],"style":{"fill":"#2d241d"},"text":{"content":"Summer Walk","language":"en","font":{"family":["Inter","sans-serif"],"size":26},"align":"left","verticalAlign":"top","lineHeight":1.2,"rotation":0,"renderMode":"p5-text"}},{"id":"title-ja","type":"text","drawStrategy":"text","bbox":[0.72,0.1,0.18,0.07142857142857142],"style":{"fill":"#2d241d"},"text":{"content":"夏の散歩","language":"ja","font":{"family":["Noto Sans JP","sans-serif"],"size":28},"align":"center","verticalAlign":"top","lineHeight":1.2,"rotation":0,"renderMode":"p5-text"}},{"id":"title-ko","type":"text","drawStrategy":"text","bbox":[0.72,0.17857142857142858,0.18,0.07142857142857142],"style":{"fill":"#2d241d"},"text":{"content":"여름 산책","language":"ko","font":{"family":["Noto Sans KR","sans-serif"],"size":26},"align":"center","verticalAlign":"top","lineHeight":1.2,"rotation":0,"renderMode":"p5-text"}},{"id":"title-th","type":"text","drawStrategy":"text","bbox":[0.64,0.2571428571428571,0.28,0.07857142857142857],"style":{"fill":"#2d241d"},"text":{"content":"เดินเล่นหน้าร้อน","language":"th","font":{"family":["Noto Sans Thai","sans-serif"],"size":28},"align":"center","verticalAlign":"top","lineHeight":1.2,"rotation":0,"renderMode":"p5-text"}}]}]}
